{"caption_span_id":"span_tbl_caption","cell_span_ids":["span_cell_r0c0","span_cell_r0c1"],"column_headers":["項目","基準値"],"doc_id":"doc_gl_sepsis_2024","extraction_votes":[{"confidence":0.92,"extractor":"yomitoku","raw_text":"体温|基準値"}],"normalized_table_hash":"sha256:1111111111111111111111111111111111111111111111111111111111111111","reading_order":["span_cell_r0c0","span_cell_r0c1"],"row_headers":["体温"],"table_id":"tbl_vitals_001"}