[{"caption_span_id":"span_vitals_caption","cell_span_ids":["span_cell_r0c0","span_cell_r0c1","span_cell_r1c0","span_cell_r1c1","span_cell_r2c0","span_cell_r2c1","span_cell_r3c0","span_cell_r3c1"],"column_headers":["基準","対応"],"doc_id":"doc_vitals_protocol","extraction_votes":[{"confidence":0.94,"extractor":"yomitoku","raw_text":"体温≧38.0℃|解熱薬投与\n体温≧38.5℃|冷却処置\n心拍数>90|経過観察\n血圧<90|輸液負荷"}],"normalized_table_hash":"sha256:7fa1c604fe1b237ac3f151554d42b30f54691222f7cc0dde3d1b3f39ead43fd1","reading_order":["span_cell_r0c0","span_cell_r0c1","span_cell_r1c0","span_cell_r1c1","span_cell_r2c0","span_cell_r2c1","span_cell_r3c0","span_cell_r3c1"],"row_headers":["体温基準1","体温基準2","心拍数基準","血圧基準"],"table_id":"tbl_vitals"}]